{
  "schema": "osd-evaluation/v1",
  "feature": "agent-runtime-governance-foundation",
  "context_package_version": "1",
  "policy_version": "1",
  "deterministic_checks": [
    {"command_id":"node-test","exit_code":0,"covered_acceptance_criteria":["AC-01","AC-02","AC-03","AC-04","AC-05","AC-06","AC-07","AC-08","AC-09","AC-10","AC-11","AC-12","AC-13","AC-14"]},
    {"command_id":"osd-structural","exit_code":0,"covered_acceptance_criteria":["AC-03","AC-09","AC-10","AC-11","AC-13","AC-14"]}
  ],
  "optional_graders": [{"evaluator":"implementation-review","rubric_version":"v1","status":"not_run"}]
}
